{
  "$schema": "https://json-schema.org/draft/2020-12/schema",
  "$id": "https://socioprophet.io/schemas/workspace/professional-workroom.schema.json",
  "title": "ProfessionalWorkroom",
  "type": "object",
  "additionalProperties": false,
  "required": ["schemaVersion", "baseWorkroomRef", "workroomId", "workroomType", "title", "status", "contextRefs", "evidenceRefs", "tasks"],
  "properties": {
    "schemaVersion": { "const": "v0.1" },
    "baseWorkroomRef": {
      "type": "string",
      "description": "Reference to the base Workroom container that this ProfessionalWorkroom profiles."
    },
    "workroomId": { "type": "string" },
    "workroomType": { "type": "string", "enum": ["client", "matter", "asset", "project", "initiative", "demo"] },
    "title": { "type": "string" },
    "status": { "type": "string", "enum": ["draft", "active", "review", "closed", "archived"] },
    "tenantId": { "type": "string" },
    "playbookId": { "type": "string" },
    "contextRefs": { "type": "array", "items": { "type": "string" } },
    "policyRefs": { "type": "array", "items": { "type": "string" } },
    "policyDecisionRefs": {
      "type": "array",
      "items": { "type": "string" },
      "description": "Policy or guardrail decision refs explicitly admitting, denying, quarantining, or requiring review for workroom operations."
    },
    "obligationRefs": { "type": "array", "items": { "type": "string" } },
    "agentRunRefs": { "type": "array", "items": { "type": "string" } },
    "topicPackRefs": {
      "type": "array",
      "items": { "type": "string" },
      "description": "Slash-topic topic-pack or membrane refs scoping search, knowledge, policy posture, source admission, and display behavior."
    },
    "memoryScopeRefs": {
      "type": "array",
      "items": { "type": "string" },
      "description": "Refs describing governed memory/retrieval scope, representation strata, recall bounds, and writeback boundaries."
    },
    "privacyDecisionRefs": {
      "type": "array",
      "items": { "type": "string" },
      "description": "DoNotLearn / DoNotLink privacy decision refs for learning, linking, memory, transcript, topic, or graph operations."
    },
    "audioReviewRefs": {
      "type": "array",
      "items": { "type": "string" },
      "description": "Speechlab audio review refs for audio events, transcript artifacts, review sections, corrections, and audio review receipts."
    },
    "learningReceiptRefs": {
      "type": "array",
      "items": { "type": "string" },
      "description": "Systems-learning-loops or model-governance-ledger receipts recording lessons, memory decisions, teaching-object promotion, or adoption feedback."
    },
    "officeArtifactRefs": {
      "type": "array",
      "items": { "type": "string" },
      "description": "Workspace-bound office artifacts such as documents, spreadsheets, slide decks, PDFs, mail drafts, calendar items, task lists, notes, and media assets."
    },
    "contextGraphRefs": {
      "type": "array",
      "items": { "type": "string" },
      "description": "Workspace Context Fabric graph refs bound to this workroom."
    },
    "providerCaptureRefs": { "type": "array", "items": { "type": "string" } },
    "providerProjectionRefs": { "type": "array", "items": { "type": "string" } },
    "shareGrantRefs": { "type": "array", "items": { "type": "string" } },
    "recallCandidateRefs": { "type": "array", "items": { "type": "string" } },
    "runtimeBindingRefs": { "type": "array", "items": { "type": "string" } },
    "semanticReceiptRefs": { "type": "array", "items": { "type": "string" } },
    "evidenceRefs": { "type": "array", "items": { "type": "string" } },
    "adoptionEventRefs": { "type": "array", "items": { "type": "string" } },
    "tasks": {
      "type": "array",
      "items": {
        "type": "object",
        "additionalProperties": false,
        "required": ["taskId", "title", "status"],
        "properties": {
          "taskId": { "type": "string" },
          "title": { "type": "string" },
          "status": { "type": "string", "enum": ["todo", "doing", "review", "done"] },
          "owner": { "type": "string" },
          "officeArtifactRef": {
            "type": "string",
            "description": "Optional OfficeArtifact associated with this task."
          },
          "topicPackRef": { "type": "string" },
          "memoryScopeRef": { "type": "string" },
          "privacyDecisionRef": { "type": "string" },
          "audioReviewRef": { "type": "string" },
          "learningReceiptRef": { "type": "string" },
          "contextGraphRef": { "type": "string" },
          "providerProjectionRef": { "type": "string" },
          "evidenceRef": { "type": "string" }
        }
      }
    },
    "labels": { "type": "object", "additionalProperties": { "type": "string" } }
  }
}
